,title,author,dept,year,advisor,abstract
186,Fire and Flour,"Anderle, Lucy",English,2016,"Peltason, Timothy","Fire and Flour is the result of over 30 hours of oral histories conducted with my family in Martinique. I was awarded the Schiff Fellowship in order to pursue research for my creative writing thesis, and used the money to fly to Martinique to conduct my interviews in person. A creative ""novella"", Fire and Flour compiles and remembers a history of deep personal importance."
187,Natural Product Derivatives as Promising Anti-Pancreatic Cancer Agents,"Zhang, Hong",Chemistry,2015,"Carrico-Moniz, Dora",
188,Constructing an Autocorrelation System to Identify Single Nitrogen Vacancy Centers in Diamond,"Paik, Eunice",Physics,2015,"Berg, Robert","The nitrogen-vacancy (NV) center is a defect in the structure of diamond, roughly the size of a single atom, that possesses properties that make it applicable to quantum information processing, high-resolution magnetic resonance imaging, and probing biological systems. When an NV center is excited by green light of wavelength 523 nm, it emits red light of in the range from 600-800 nm tens of nanoseconds later. A confocal microscope can be used to excite and collect emitted photons from NV centers. By detecting the intensity of the emitted red photons, we can determine the quantum state of a single NV center, which is needed to build various quantum computing, sensing and imaging devices. The autocorrelation method is used to detect antibunching in the emission of red photons and ascertain that the observed photons are being emitted from a single NV center. We have built an autocorrelation device that measures, with sub-nanosecond accuracy, the statistical distribution of the arrival times of the red photons emitted from a diamond sample at a photon counter. The device can measure fixed time values with a time resolution of 120 ps FWHM. For uncorrelated sources measured for 120 seconds at the TAC full range of 100 ns, the average counts in each histogram bin were about 0.01% of the predicted value. The autocorrelation device that we have built costs about 10 times less than commercial units used by other NV researchers."
189,The role of COW1 orthologs in protonemal development in Physcomitrella patens,"Cravens, Elena",Biological Sciences,2015,"Peterman, T. Kaye",
190,"Internet Culture, Nature, and Fanart: A Year of Exploration in Technique and Inspiration","Hunt, Katherine",Media Arts and Sciences,2015,"Olsen, David Teng",
191,Networking in the Dark: Social Capital and Online Networks for Less Privileged College Applicants,"Rowcroft, Debra",Sociology,2019,"Rutherford, Markella","This project analyzes the different ways less privileged students apply to college, the tools they use to prepare for admissions, and the information they receive from their networks about higher education. Building from Bourdieu's theories on capital and field, this study highlights how students from non-dominant backgrounds have to adapt and overcome to succeed in an admissions system designed to reward the cultural capital available to students from educated families. I conducted 18 in depth, semi structured interviews with high school students and recent graduates to uncover the motivations and behaviors in their college choice process. Information in their immediate networks and affiliation with college-access programs were able to ""intervene"" and introduce students to the preparation behaviors necessary for elite college admission. Students with college access program (CAP) affiliations were able to prepare for college admissions in a collaborative way, with the help of newfound social connections facilitated by their CAPs. Students without program assistance were less likely to reach to their networks and engaged with the college application process in a more independent manner."
192,Faith and Feminicide: The Catholic Church's Efforts to Combat Feminicide in Guatemala,"Ruden, Majaella",Peace and Justice Studies,2019,"Hajj, Nadya","In contemporary Guatemala, women frequently fall victim to the crime of feminicide, the ""systematic"" ""killing of females by males because they are females (Tierney FitzGerald 2016, 2; Russell 2001, 13)."" By drawing on scholarship from multiple academic disciplines including Women's and Gender Studies, Theological Studies, Peace and Justice Studies and Political Science, this study aims to expand its readers' understanding of feminicide and increase their ability to help address this phenomenon. To do so, I answer the central research question: Though it has acted as a protector of the country's most vulnerable communities in the past, is the Catholic Church, in fact, working to reduce rates of feminicide in post-civil war Guatemala? And, if so how? An analysis of the Guatemalan Catholic Church's nine post-war collective pastoral letters, the individual actions of the thirty-one Guatemalan Catholic bishops who signed those letters, and the programs hosted by six Guatemalan Catholic social organizations ultimately reveals this religious institution is neither working to reduce the country's feminicide rate nor acting in ways that cause it to worsen."
193,Evolutionary Development of the Mammalian Pre-Sternum,"Yozgyur, Zeynep",Biological Sciences,2019,,"The mammalian sternum has undergone a reduction in relative size and complexity over evolutionary time. This transformation was highly variable across species, generating multiple, controversial interpretations. Some authors claim that the evolutionary reduction led to loss of presternal elements, while others believe that all, or some, presternal elements were fused into a structure ambiguously referred to as the ""manubrium"", a term adopted from the post-interclavicular unit of pre-mammalian ancestors. Previous work on the Paramylodon harlani presternum revealed a composite presternum and identified three elements - mediocranial, mediocaudal and lateral - each with a different developmental origin and marginal articulation. This project used medical and micro CT scans to determine if these elements are conserved across species and if there is a characteristic histology associated with each. All three elements were identified in humans based on their locations and articulations. Their fusion during ontogeny was documented. Elements could not be associated with a characteristic histology. Instead, histology appears to reflect the mechanical forces to which different regions of the presternum are subjected, whatever their developmental origin. This opens the possibility that the presternum can be used to infer the limb use and locomotor style of extinct taxa. These lines of evidence indicate that the reduction of relative sternal size seen over evolutionary time has not led to element loss. Instead, three conserved elements with unique developmental origins and articulations are present in a composite presternum. Further, this reasoning suggests that the use of the term ""manubrium"" should be abandoned as ambiguous and instead when referring to specific areas on the presternum the terms interclavicle, sternal bands, and lateral elements should be used."
194,"""Nobody—I Myself"": The Feminine Self in Shakespearean Tragedy and Romance","Zhang, Ruixi",English,2019,,
195,Smile: The Feminist Vision of Jean Rhys,"Roberts, Margaret",English,2019,"Rodensky, Lisa",
196,Why She Didn't Just Leave: The Effect of Nuisance Ordinances on Domestic Violence,"Moss, Emily",Economics,2019,"Shastry, Gauri Kartini","Municipalities throughout the country have adopted nuisance ordinances to recruit landlords in assisting with crime control. Nuisance ordinances are municipality-level policies that sanction landlords if police are frequently called to respond to a landlord's tenants. To avoid a fine, landlords must abate tenants whose conduct was considered a nuisance under the municipality's ordinance; most often, this abatement process involves evicting the tenant. Little research has evaluated the impact of nuisance ordinances on innocent tenants - particularly, female victims of domestic violence. Because domestic violence is seldom excluded from the list of nuisance activities considered under the ordinances, legal advocates have warned that the threat of eviction associated with nuisance ordinances could discourage domestic violence victims from reporting their abuse to the police. This thesis contributes the first econometric analysis of the effect of nuisance ordinances on domestic violence reporting and incidence. The variation in nuisance ordinance enactment across municipalities and over time provides the framework to identify the causal effect of nuisance ordinances on domestic violence using a difference-in-differences strategy. I find that nuisance ordinance enactment leads to a 16.5-23.2 percent reduction in domestic violence-related 911 calls for assistance and a 0.4-0.7 percentage point increase in self-reported domestic violence incidence in California. Nationwide, I also find nuisance ordinance enactment is associated with a statistically significant increase in online search activity related to domestic violence as a proxy for domestic violence incidence. These results suggest that nuisance ordinances have the unintended consequence of discouraging domestic violence victims from reporting their abuse, thereby allowing the incidence of domestic violence to persist."
197,Towards understanding the variability between rates of biological productivity in the Beaufort Gyre of the Arctic Ocean,"Ji, Brenda Y",Biological Sciences,2018,,"Oceans account for more than 25% of anthropogenic CO2 removal from the atmosphere. Changes in our global climate have affected the Arctic Ocean in particular, resulting in increasing rates of warming and record-low sea ice extent, which for example, in the summer of 2012, was only half of the average over the previous three decades. It is unclear how these changes in the Arctic Ocean may affect biological productivity, which is one of the main drivers of the oceanic carbon cycle as CO2is consumed through photosynthesis and released through respiration. In order to investigate how these changes may influence the efficacy of the Arctic Ocean as a carbon sink, we calculated the gross oxygen production (GOP), which is the rate of total photosynthesis, and the net community production (NCP), which is the rate of photosynthesis minus community respiration and thus represents the strength of the carbon sink. The chemical gas tracers, triple oxygen isotopes and O2/Ar ratios, as measured in samples from the surface waters of the Beaufort Gyre region of the Canada Basin, were used to quantify gross oxygen production and net community production, respectively, in late summer and early fall over six years (2011-2016). We examined the effects of location, ice cover, chlorophyll-a, season, and more to better understand the collective impact of these physical conditions on biological productivity rates. Over these six years, mean GOP rates ranged from 9.1 ± 1 mmol O2 m⁻² d⁻¹ to 40 ± 4 mmol O2 m⁻²d⁻¹ and mean NCP rates ranged from 1.1 ± 0.2 mmol O2 m⁻² d⁻¹ to 2.5 ± 0.2 mmol O2 m⁻² d⁻¹. Analyzing inter-annual variations in these rates can enlighten our understanding of how dramatic changes in the global climate may impact the ability of this region in the Arctic Ocean to remove carbon dioxide from the atmosphere."
198,The Influence of Deep Convection on Biologically Driven Carbon Sequestration in the Irminger Sea,"Wanzer, Lucy",Geosciences,2019,,"The North Atlantic plays a key role in sequestering anthropogenic carbon. The biological carbon pump is one of the mechanisms by which carbon is sequestered in the ocean. Phytoplankton photosynthesize at the sea surface, and fix carbon dioxide into organic carbon, a fraction of which sinks to the deep ocean. For sinking carbon to be stored long-term (time scales > 1 year), it must sink deeper than the winter ventilation depth before being respired. This study focuses on how deep winter ventilation (convective mixing to depths > 1000 m) in the Irminger Sea influences the sequestration of carbon via the biological pump. We analyze a four-year continuous time series (September 2014 to June 2018) of temperature, salinity, dissolved oxygen, optical backscatter, and chlorophyll fluorescence depth profiles from 200 to 2,600 meters from the Apex Profiler Mooring at the Ocean Observatories Initiative (OOI) Global Irminger Sea Array (60.0°N, 39.5°W). Temperature, salinity, and dissolved oxygen data are used to identify the depth and timing of winter mixing. Using dissolved oxygen as a tracer for respiration of sinking organic matter, optical backscatter as a tracer of particulate organic matter, and chlorophyll as an indicator of surface-derived photosynthetic material, the amount of sinking organic carbon ventilated back to the atmosphere in winter, as well as the carbon that escapes below the winter ventilation depth, is evaluated. We present data collected during a research cruise to the Irminger Sea in June 2018, where we collected discrete samples to calibrate sensors on the OOI Apex Profiler Mooring, and determined variability in the depth of winter mixing across the Irminger basin (59.6° - 64.2° N and 21.9° - 41.4° W) using 20 depth profiles of temperature, salinity, and dissolved oxygen from CTD casts. Evidence of deep winter convection was found throughout the basin, though there is variability in the maximum depth of convection, ranging from 1100 to 1500 meters. Using the 2014-2018 time series of data collected by the profiler mooring, we found strong interannual variability in both winter ventilation depths and respiration rates from the in the Irminger Sea, with winter ventilation depths ranging from 800 to 1,150 meters over the four year time period, and depth-integrated respiration rates within the seasonally-ventilated thermocline ranging from 3.62 to 7.66 mol O2 m⁻². We find the highest respiration rates in the upper thermocline which contribute the majority of the carbon that is released back into the atmosphere during mixing. We also find that winter ventilation depth influences how much carbon is ventilated into the atmosphere during winter mixing. This study shows the importance of year-round observations in order to better understand how deep convection influences carbon sequestration by the biological pump."
199,Rethinking Pelvic Morphological Variation and Its Relation to Parturition Status,"Navickas, Kelly",Anthropology,2019,"Van Arsdale, Adam
Minor, Elizabeth",
200,The Medieval Slut: Sexual Identities of Medieval Women in the Patriarchal Narratives of the Decameron and Canterbury Tales,"Rea, Rosalynd",Medieval and Renaissance Studies,2019,"Whitaker, Cord","""Slut"" is not inherently a ""bad word."" ""Slut"" is, however, a great label; it labels one's sense of promiscuity and autonomy as an aspect of sexual identity. This label, used extensively in modern sexual politics, is anachronistic, yet describes much of the behavior of the women of late medieval literature. Thus the medieval slut's sexual identity focuses on the proliferation of sex and sexuality that seems shameful within her patriarchal narrative, and yet says something truly powerful about who she is in addition to her sexuality. This study examines the stories of specific medieval sluts in order to destabilize traditional readings of the Decameron and Canterbury Tales in favor of a more accurate display of women's desire. A reading in the style of the medieval slut reinforces the ethical framework with which the sluts are already working in order to demonstrate the power that comes from the reclaimed term ""slut."""
201,"Misiones educativas en España y México: pedagogía, colonización y adoctrinamiento en la construcción de la nación moderna","Simon, Julia",Spanish,2019,"Ramos, Carlos",
202,"Managing the Nazi Legacy: Contradictory Reconstruction Policies in US-Occupied Germany, 1945-1952","Speyer Besancon, Rachel",Political Science,2019,,"This thesis seeks to identify the circumstances in the postwar United States that allowed American foreign policymakers to pursue contradictory denazification programs in occupied Germany. On May 8, 1945, Germany transformed from a sovereign state to an occupied territory. The United States and its Allies were tasked with administering the agreed upon plans for occupation in Germany, predominantly focused on denazification and reconstruction. In the American zone, the Occupying Military Government's plans for denazification and reconstruction affected segments of the population very differently. While low-ranking public officials were banned from public service due to their ties to the Nazi regime, powerful industrialists and governmental leaders were gradually welcomed back into positions of responsibility with the government. How did the US government justify its inconsistent enforcement of the Nazi purge and what enabled them to pursue these policies? I argue that the unsettled narrative landscape of postwar America made such contradictions tenable in a chaotic political climate. Through a cultural study of American popular media from 1939-1950, I identify the three dominant narratives of ""the German"" in the US during this time and show how each of these narratives were used to legitimate different reconstruction policies in US-occupied Germany."
203,Reading Mythology in Ocean Vuong's Night Sky With Exit Wounds through Just Memory,"Tran, Havannah",English,2019,"Lee, Yoon Sun
Gonzalez, Octavio R.","In his debut poetry collection, Night Sky with Exit Wounds, queer Vietnamese-American refugee poet Ocean Vuong claims his work is ""an attempt to navigate history through a rewriting or rather, a recasting, of history into a mythology, much in the tradition of our poetic forebears, like Homer, Dante, Milton."" In this myth-making, closely related to memory and the constitution of empire, I read Vuong's collection through scholar and novelist Viet Thanh Nguyen's ""just memory"", a way of memorialization that seeks to give voice to all people involved in conflict, examines the conditions in which war memory is produced, and explains how memory is in service of creating the identity of a nation. I look at the poems ""Telemachus"", ""In Newport I Watch My Father Lay His Cheek to a Beached Dolphin's Wet Back"", ""My Father Writes From Prison"", and ""To My Father / To My Future Son"" as they constitute the mythology of the father, a figure who creates memories of war that Vuong has no access to. I use this framework in relation to its original intent, as a way of configuring national identity through war memory, but also in understanding a queer mythology Vuong puts forth, one that also questions the American identity as a heteronormative ideal. I turn to the poems ""Of Thee I Sing"", ""Seventh Circle of Earth"", ""Because It's Summer"", ""On Earth We're Briefly Gorgeous"", and ""Devotion"" in understanding this queer mythology. What proceeds is a broad understanding of Vuong's poetry, in its attempt to give voice to the voiceless and critique the identity/identities of the United States."
204,The Scientist and American Cinema: Trends and Case Studies,"Wardlow, Ciara",Cinema and Media Studies,2019,"Knouf, N. Adriana","This thesis explores historical trends in the depiction of scientists in popular film from 1931 to present, emphasizing how both scientific developments and current events influence the characterization of movie scientists and how these popular depictions of scientists can, in turn, have real-world influence. In addition to giving a historical overview of these trends, this thesis examines case studies looking specifically at the evolving relationship between space science and cinema, the representation of historical scientists in biographical films, and the evolution of scientist characters in two scientist-starring short stories, ""Who Goes There?"" and ""The Fly,"" and their respective film adaptations and subsequent remakes."
205,An Unbiased Variance Estimator of a K-sample U-statistic with Application to AUC in Binary Classification,"Guo, Alexandria",Mathematics,2019,"Wang, Qing","Many questions in research can be rephrased as binary classification tasks, to find simple yes-or-no answers. For example, does a patient have a tumor? Should this email be classified as spam? For classifiers trained to answer these queries, area under the ROC (receiver operating characteristic) curve (AUC) is a popular metric for assessing the performance of a binary classification method, where a larger AUC score indicates an overall better binary classifier. However, due to sampling variation, the model with the largest AUC score for a given data set is not necessarily the optimal model. Thus, it is important to evaluate the variance of AUC. We first recognize that AUC can be estimated unbiasedly in the form of a two-sample U-statistic. We then propose a new method, an unbiased variance estimator of a general $K$-sample U-statistic, and apply it to evaluate the variance of AUC. We suggest choosing the most parsimonious model whose AUC score is within 1 standard error of the maximum AUC. The developed procedure improves model selection algorithms that weigh complexity and performance. To realize the proposed unbiased variance estimator of AUC, we propose to use a partition resampling scheme that yields high computational efficiency. We conduct simulation studies to investigate the performance of the developed method in comparison to bootstrap and jackknife variance estimators. The simulations suggest that the proposal yields comparable or even better results in terms of bias and mean squared error. In addition, it has significantly improved computational efficiency compared to its resampling-based counterparts. Moreover, we also discuss the generalization of the devised method to estimating the variance of a general $K$-sample U-statistic (K >= 2), which has broad applications in practice."
206,"Cultural Vibrations: Measuring the Dominant Creative Class in Times of Conflict: West Jerusalem 2014 to 2016, A Case Study","Neustein, Ellie",Political Science,2018,"Hajj, Nadya
Logvinenko, Igor","When walking in Jerusalem one cannot help but notice the presence of political and religious street art. Slogans, portraits of political and religious figures, ironic political statements, and religious symbols are spray painted, hung, or plastered in public view. At first glance the city seems to be peppered with political expression originating from authentic roots of civil society- the artisan social commentators. However, upon reflection, one comes to notice that much of the paint is chipped, and the political commentary is no longer relevant to contemporary issues. It is puzzling that a population having just achieved renewed dominant status in a military operation (Operation Protective Edge, 2014), simultaneously experiences a decline in private political-cultural participation, specifically through street art. This study measures the fluctuations in street art in Jerusalem going back, before summer 2014 to capture the decline in street art during military operations. This study finds that decline in creative class public expression is linked primarily to intervening institutions working to stimulate culture in Jerusalem. We attribute part of this observed cultural lull to such institutions stopping to stimulate culture, specifically, during military operations."
207,Sliding on a Massive Spinning Asteroid: Order and Chaos,"Peltz Smalley, Hannah",Physics,2018,"Berg, Robbie
Lindner, John","In 2017 an interstellar visitor, 'Oumuamua, was discovered by Robert Weryk at Haleakala Observatory, Hawai'i. Analysis of 'Oumuamua's light curve suggests it has a highly elongated shape. The dynamics of such irregularly shaped objects cannot be modeled with simple approximations; while Newton's sphere theorem allows us to model the gravitational dynamics of spherically symmetric objects as point masses, a spherical approximation is insufficient to describe the interactions of highly elliptical objects like 'Oumuamua -- and even Earth, which is not a true sphere but rather an oblate spheroid. Fortunately, there exist closed-form expressions for the gravitational potential of a spheroid. For this project, I use Mathematica to solve systems of nonlinear differential equations to model the motion of an object sliding on such a spheroid. Under certain conditions, the path of the slider becomes highly sensitive to initial conditions. This sensitivity manifests as chaos, which is apparent both qualitatively and quantitatively."
