,title,author,dept,year,advisor,abstract
284,“Reforming the Individual” : State of Reentry Services for Incarcerated Women in Massachusetts,"Obolenskaya, Christine",Sociology,2020,"Rutherford, Markella
Cuba, Lee
Kaliner, Matthew","Global concern has risen over the incarceration of marginalized communities in the United States, but not enough attention is given to the gender-specific dimension of this phenomenon as under ten percent of the incarcerated population is female. This project studies the reentry and community-based services provided to formerly incarcerated women in Massachusetts. Reentry services attempt to reintegrate incarcerated individuals back into their own communities and greater society by means of employment access, housing options, addiction services and more. I analyzed qualitative data from collecting interviews from members of organizations and services that exist to serve women during their reentry process in Boston, Massachusetts. The narrative of reentry service providers revealed the expectations that are placed on incarcerated women to accomplish a level of emotional labor, as a way to access reentry resources. In addition, reentry service providers were found to fit into three typologies of thinking about the criminal justice system that influenced their provision of work — abolishment, rehabilitation and punishment."
285,No White Man Could Be Punished: How the Supreme Court Promoted White Supremacy and Racial Violence in the Late Nineteenth Century,"Lipin, Margot",History,2020,"Quintana, Ryan",
286,Partial Configuration Spaces As Pullbacks Of Diagrams Of Configuration Spaces,"Li, Amy Qing Hai",Mathematics,2020,"Volić, Ismar","Partial configuration spaces are configuration spaces where some points are allowed to coincide. We express partial configuration spaces as the pullback of diagrams of ordinary configuration spaces. Furthermore, we provide some computations of the cohomology in low degrees of the partial configuration spaces with the aim of supplying some evidence that this limit is also a homotopy limit."
287,An Investigation of the Relationship Between Sci-fi imaginations and Academic Endeavors on Digital Technologies-- Taking Chinese Sci-Fi and Scholarly CS Publications As an Example,"Wang, Lizao",Media Arts and Sciences,2020,"Olsen, David T.
Metaxas, Panagiotis
Hildreth, Ellen C
Song, Mingwei","With the discussion of whether Sci-Fi inspires, or even design the future becoming increasingly popular, this thesis provides a way to understand the problem with a data-based and comparative method. A digital experience is also incorporated."
288,"Immigrant Detention and State Interests: Race, Capital, and Sustaining the Carceral State","Nunez, Maya",Political Science,2020,"Grattan, Laura",
289,Asteroids-for-all: building an open-source asteroid detection linking software,"Tan, Nicole",Astrophysics,2020,"McLeod, Kim
Nugent, Carrie","We developed the first free and open-source asteroid detection linking software for use with time-series sky survey data. It takes cleaned Source Extractor outputs of non-stationary detections from the images and finds tracklets representing asteroid motion within them. The linking software is a Python-based program that incorporates Find_Orb, an orbit determination program by Bill Gray. The bulk of the program identifies candidate tracklets based on exposure-to-exposure object movement. The program runs through all possible combinations of observation linkages, feeds possible tracklets through Find_Orb, and identifies candidate tracklets based on user-defined criteria including angular speed, angle between detections and mean residuals from Find_Orb. We tested the software with data from the Near-Earth Asteroid Tracking (NEAT) survey and from the Palomar Transient Factory (PTF). For NEAT tests with artificial noise added, we found that the code performed ideally for noise levels up to 80%. In the PTF tests, we discovered a previously unreported asteroid position. Subsequently, we have submitted this tracklet to the Minor Planet Center. Our trials show that under ideal conditions, the linking software is able to perform on par with the linking capabilities of the NEAT and PTF systems, which have a more complex design."
290,Reimagining the African Union: A More People-Centered Approach,"Alexis, Laissa",Peace and Justice Studies,2020,"Murphy, Craig",
291,Widening the Gap: The Political History of Medicare Advantage and its Implications for Medicare-For-All,"Habel, Samantha",Political Science,2020,"Burke, Tom",
292,Low-Energy Electron-Induced Reactions of Water,"Abdullahi, Sebiha M.",Biological Chemistry,2015,,
293,"Queer Sexualities, Normative Bodies: The Fat Body in Queer-Centered Television","Stout, Charlotte",American Studies,2020,"Jeffries, Michael",
294,"Planning, Implementation, and Effective Change in the Food System","Gosch, Kelsey",Environmental Studies/Science,2020,"DeSombre, Beth",
295,Defining the Feminine in Ruskin and Baudelaire,"McNally, Megan",Art,2020,"Oliver, Liza","Defining the Feminine in Ruskin and Baudelaire discusses the representation of womanhood in the work of nineteenth-century art critics John Ruskin and Charles Baudelaire, as well as the symbolic meaning they placed upon the feminine. Their writings are analyzed in the context of works by artists of their milieux, including Édouard Manet, Constantin Guys, and the Pre-Raphaelite Brotherhood. The thesis is divided into three chapters: ""Woman: Truth to Nature,"" ""Woman and the Modern Market,"" and ""Mothers and Monsters."""
296,"The Design and Implementation of Venbrace, a Text Language for App Inventor","Huang, Ruanqianqian",Computer Science,2020,"Turbak, Franklyn","Blocks programming environments (BPEs) lower barriers to programming using visual code fragments that prevent syntactic and static semantic errors and reduce cognitive load. App Inventor, for example, provides a BPE that helps programmers of all levels to build mobile device apps easily. However, visual blocks notations can make programs more difficult to read, write, edit, and share. Dual-mode environments that allow bidirectional conversion between isomorphic blocks and text representations can leverage the benefits of both modes. Having recognized the advantages of allowing textual editing as a plug-in in BPEs, I have designed Venbrace, a fully-braced textual syntax isomorphic to the blocks-based programming language in App Inventor, based on a collection of design principles. I implemented a lexer, a parser, and a syntax editor for Venbrace. To ensure the usability of Venbrace, I also developed, conducted, and did a preliminary analysis of the first round of a user study (with 17 subjects) to evaluate its initial syntax design, determine some design choices, and explore possible improvements. This project aims to (1) increase App Inventors general usability, (2) maximize the usability of Venbrace through user studies, and (3) confirm the benefits of evidence-based programming language design. Keywords: App Inventor, Blocks Programming, Evidence-Based Programming Language Design, Human-Language Interaction (HLI)"
297,The World We Built,"Conte, Abigail",Art,2020,"Miller, Kelsey
Rivera, Daniela",The World We Built is a project built around fantasy tabletop role-playing games and the potential they have as outlets for queer expression and empowerment. A year-long exploration of experimental tabletop game design and illustration resulted in a book that serves as a physical manifestation of my belief in the deep value of play.
298,"To Walk Honorably Through the World: Temperance, Gender, and Religion in Anne Brontë's The Tenant of Wildfell Hall","Johnson, Emma",English,2020,"Meyer, Susan L.",
299,Intraspecific Above and Below Ground Economics Spectra in Oak (Quercus spp.) Seedlings,"Paradiso, Eva Davis",Environmental Studies/Science,2020,"Griffith, Alden
Matthes, Jackie
Matthes, Erich",
300,Changing Cultural Paradigms in Choral Programming,"Cheli, Ciara",Music,2020,"Graham, Lisa",
301,Where Political News and Algorithms Meet: A Longitudinal Audit of Google’s Top Stories,"Umarova, Khonzodakhon",Computer Science,2020,"Mustafaraj, Eni","Over the years, Google has become a very important player on the Web. Among many other impacts, Google Search and its algorithms have a significant role in the information ecosystem. Often, when you do not know something, you search for the answer or relevant information by ``googling'' it. In response to your search query, Google returns a page filled with various pieces of information. Sometimes, among the results to your search, Google presents Top Stories --- a panel with news stories related to your search phrase. Out of thousands of news articles published daily on certain topics, Google chooses to present only ten articles. How does Google's algorithm make this choice? Are the articles or publishers shown to you ``better'' than others? What factors does Google consider to decide? In order to answer these questions, it is possible to conduct an algorithmic audit --- a thorough study that aims to understand algorithm and its choices. In this thesis, I present the results of conducting a longitudinal algorithmic audit of the Google's Top Stories algorithm. I worked with a dataset that contains a whole year of Top Stories that appear when one searches for the names of political candidates running for the 2020 US Presidential Election. My goal is to answer in an empirical way the question: What does a one-year-long audit of Top Stories reveal about the ways Googles algorithm shapes the public access to the online news coverage of political elections?"
302,The Intersectionality of Music and Healing: How the Panamá Jazz Festival Brings Hope to and Cultivates Resilience in the Youth in Panamá City,"Frazer, Rachel",Music,2020,"Goldschmitt, K.E.
Johnson, Jenny",
303,Students who work or Workers who study? Student-Workers in a Static Society,"Kisken, Rachel",Peace and Justice Studies,2020,"Hajj, Nadya",
304,Paper and Glass: Objects of Interiority and Exteriority in Mary Wroth's The Countess of Montgomery's Urania,"Delaney, Margaux","Medieval and Renaissance Studies
English",2020,"Wall-Randell, Sarah",
305,Wandering the Virtual Street: Creating an Objective Measure of Individual Differences in Navigation Ability,"Clyde, Mary",Psychology,2020,"Wilmer, Jeremy","Navigation research is a rich and intriguing field for those interested in the natural differences between individuals, but research in this area is restricted by the need to bring people to a physical location to do testing. The aim of this research is to develop a web-based navigation test in order to study the individual differences in navigation ability of a larger sample than used in previous research. To determine an individuals ability to create and update a ""mental map"" of new environments, the new measure asks participants to find the shortest path to various points around virtual environments created using the Unity game design platform. By creating and refining a new web-based measure, this research can provide future researchers with the tool they need to gain important insight into the psychology of individual differences, navigation ability and navigation strategy. Two rounds of testing and refinement of the new Virtual Navigation Test found the new measure to be a reliable measure of mental mapping ability. The results of the second study replicated the dissociation of self-reported and behaviorally measured navigation ability reported in prior research and the sex differences seen in prior research in navigation, initial evidence that the Virtual Navigation Test may be a valid test of mental mapping ability and navigating virtual environments."
306,Characterization of spontaneous parametric down-converted light,"Griffith, Dana",Physics,2020,"McAskill, Tracy
Habif, Jonathan",
307,Random walk simulation of p-n junctions,"Wang, Jennifer",Physics,2020,"Hu, Yue","Random walks rely on stochastic sampling instead of analytical calculations to simulate complex processes; thus, these methods are flexible and mathematically simple. In the semiconductor field, random walks are often utilized to model bulk transport of charge carriers. However, junction transport models generally rely on more complex numerical methods, which are computationally unwieldy and opaque to a general audience. To aim for greater accessibility, this thesis applies random walks to simulate carrier transport in p-n junctions. We first show that our random walk methods are consistent with finite-difference methods to model drift-diffusion processes. Next, we apply a basic random walk to model a p-n junction at equilibrium. This demonstrates successful proof-of-concept simulation of the depletion layer, as well as calculation of the the electric field and potential of a typical p-n junction. Additionally, because the basic random walk assumption cannot incorporate different mobility parameters for electrons and holes, we develop an improved compound p-n junction model. We demonstrate that the compound model is consistent with the basic model, and that it is adaptable to realistic material parameters for both electrons and holes."
308,Interpretations of Number Words Across French and English,"Van Voorhees, Kira",Cognitive and Linguistic Sciences,2020,"Bassa Vanrell, Maria del Mar
Lucas, Margery
Pyers, Jennie
Kerr, Megan","The semantics and pragmatics of number words remain a longstanding debate among linguists and psychologists alike, as their interpretation across sentences is variable, resulting in at least, exactly, and even at most readings. Numerals can appear in many different grammatical roles in natural language, including predicative, arithmetical, quantifying, adjectival, and measure, further complicating their derived versus semantic meaning. Past research has focused on the meaning of numerals within a single language, primarily English. Differences in morpho-syntactic cues in the expression of plurality and negation in French versus English lead us to hypothesize that speakers of French might be more disposed to exactly N readings of numbers than English speakers in certain environments. First, we present an overview of the three main theories of the semantics of numerals, followed by an outline of the morpho-syntactic differences in the languages. We then provide a qualitative analysis of linguistic interviews with 5 native English speakers and 5 native French speakers. We use this qualitative data to better understand the use of number words in natural language, and to further evaluate the competing semantics theories. We conclude by appealing to the need for further cross-linguistic and cross-cultural research on the interpretation of number words in natural language."
309,"Split Graphs, Unigraphs, and Tyshkevich Decompositions","Whitman, Rebecca",Mathematics,2020,"Trenk, Ann","This thesis examines several topics connected to split graphs and unigraphs. We first study a partially ordered set representation of split graphs defined by Merris, connecting properties of poset elements, called blocks, to those of split graphs and vice versa. We also find an equivalence relation between poset elements, equivalent to changing the leaf vertices of a vertex of highest degree in a split graph, and provide results for when equivalence classes are closed under various conditions. In the second part of the thesis, we investigate an inverse operation on split graphs, giving proofs for previously stated results and establishing new propositions about the relationship between the inverse operation and unigraphs, induced subgraphs, and hereditary classes. In the third part of the thesis, we use Tyshkevich decomposition to give a structural characterization of the hereditary closure of the set of unigraphs. This characterization implies several results about the nature of forbidden induced subgraphs for the hereditary class."
310,"A Tale of Homelessness in Two Cities: How Lawyers and Non-Lawyers View Providing Assistance, Confronting Barriers, Powerlessness and ‘The System’","Washburn, Faye",Political Science,2020,"Burke, Tom",
311,Spatio-Temporal Analysis and Simulation of Human Trajectories in Urban Environments,"Li, Huihan",Computer Science,2020,"Bassem, Christine","With the rapid development of mobile technology, the number of mobile internet users has increased dramatically, creating large sets of trajectory datasets rich with mobility information. Consequently, mobility route analysis and modeling is becoming increasingly important. Human mobility analysis and modeling is built on the intuition and observation that human mobility patterns demonstrate similarity across time and among crowds and are greatly affected by the landscape and transportation network, and that the similarities can be captured by a machine learned model. To aid in the discovery of human mobility patterns, I propose a new metric for quantifying the degree of similarity of movements that happen in the same time frame in a GPS trajectory datasets. The metric allows researchers to better understand the degree of spatio-temporal similarity between trajectories in a dataset. I then propose a new algorithm to extract important locations (Point of Interest) from trajectories, which effectively compresses the size of training data to be fed into machine learning models while accurately representing the real mobile patterns in the trajectories. I also propose a new algorithm for merging repetitive Points of Interest from different trajectories, so that the learning model can capture the similar mobile behavior among the crowd. Finally, I extend mobility modeling from individuals to the crowd, a topic that has been historically neglected in the mobile computing community. My design of training data parameters allows the model to generalize individual mobile behaviors and apply them to crowd mobility simulation."
312,Latex Swords and Social Norms: A Sociological Examination of Live Action Role-Play (LARP) Games,"Shook, Alexandria",Sociology,2020,"Swingle, Joseph
Hertz, Rosanna
Levitt, Peggy
Hajj, Nadya",
313,Imagine You and Me: Imagined Contact’s Role in Reducing Bias in Preschoolers,"Nicholson, Lian",Psychology,2020,"Gleason, Professor Tracy","Despite individuals' best efforts, societal messages about race seep into our minds. However, research with older children and adults shows that simply imagining a positive interaction with an outgroup member can improve attitudes. This process is called imagined contact, and in this thesis I explored the impact of imagined contact on preschoolers implicit bias towards Black children. Participants were 28 children, aged 3 to 5 years old from a local daycare center. In session one, participants completed implicit bias measures. In session two, participants were divided into either the control group or the experimental group. The latter engaged in an imagined contact scenario with a Black child whereas the former imagined playing at a park. Effects on implicit bias were measured. Understanding preschoolers implicit biases can help guide how we talk about race in the classroom, and imagination has the potential to positively influence interpersonal relationships."
314,Identity Formation Through Cultural Consumption: How second-generation young professionals in Silicon Valley negotiate the changing cultural-commercial landscape of San Francisco’s Chinatown,"Li, Christie",Sociology,2020,"Kaliner, Matt",
315,Cleaving,"Merkle, Victoria",English,2020,"Sides, Marilyn",
316,"Rumors in the Air, Resistance on the Land: Gossip, Storytelling, and the Struggle for Justice in Vieques, Puerto Rico","Martinez, Zulia",Anthropology,2020,"Ellison, Susan H.
Van Arsdale, Adam
Minor, Elizabeth
Mata, Irene",
317,Institutional Change and Politics of Constitutional Revision in Japan,"Murakami, Megumi",Political Science,2020,"Moon, Katharine H.S.",
318,Blending Methodologies: Enhancing Practice and Improving the Ethical Framework for Indigenous Archaeology Through Digital Archaeology,"Oliver, Kalei",Anthropology,2020,"MINOR, ELIZABETH","Digital methods in archaeology have been widely accepted in the past several years; from on-site excavation to post-processing, the use of computerized tools and systems aimed at facilitating the documentation, interpretation, and publication of material culture are quickly becoming the norm. This thesis discusses the ethical boundaries of these emerging technologies for Indigenous communities. As a developing sub-discipline, Indigenous Archaeology seeks to disrupt past colonial patterns and instead replace them with public-facing, collaborative research that is beneficial for Indigenous communities and cultural heritage management; I will discuss the benefits and shortcomings of digital methodologies with reference to these goals. Based on archaeological data collected from Hualcayán, Perú, self-produced 3D photogrammetry scans, and reviews of existing scholarship exploring the potential for digital reconstructions to improve public outreach—we can begin to answer the question: can digital methods lead to a more ethical archaeology that is beneficial for Indigenous communities?"
319,"Nothing certainer: Analyzing Nothing, Noting, and Gendered Power Dynamics Through Directing Much Ado About Nothing","Calvert, Paige",English,2020,"Wall-Randell, Sarah","This thesis is an exploration of the concept of ""nothing"" in relation to highly structured and gendered power dynamics within Shakespeares works. The focus is narrowed through the direction of a production of Much Ado About Nothing at a historically womens college. It follows the research and process of my time as Director for the Wellesley College Shakespeare Society in the fall of 2019 in addition to results from actor and audience surveys in relation to the material challenged."
320,Graduating with Dignity: Strategies for Navigating Liminality at an Alternative High School,"Ahn, Chelsie",Sociology,2020,"Rutherford, Markella
Cuba, Lee",
321,Does China's Economic Expansion in South Asia Constitute Imperialism?,"Ejaz, Huzaifa",Political Science,2020,"Candland, Christopher",
322,Not Talking Black: African American Vernacular English and Dialect-Based Smothering,"Foster, Edilia",Philosophy,2020,"McGowan, Mary Kate",
323,Construction of Islam and Muslims by Jacksonian Era Authors Washington Irving and Edgar Allan Poe,"Khan, Lyba",Religion,2020,"Marini, Stephen
Geller, Barbara
Elkins, Sharon
Miwa, Julia",
324,Non-monetary Incentives in Organizations,"Li, Yining",Economics,2020,"Rothschild, Casey","Intrinsic motives and non-monetary incentives are important drivers of worker satisfaction, particularly in the modern knowledge economy. Recent empirical work has established, for example, that various forms of non-monetary incentives can make workers more satisfied, more likely to stay at the firm, and more productive (e.g., Cassar and Meier, 2018). However, little theoretical work is done to understand the role of general non-monetary incentives in organizations. Hence, this thesis intends to fill that gap by developing a sequence of four models based on Bakers multi-task framework (2002) to capture the effects of non-monetary incentives on employee behavior and wage design. I argue that non-monetary incentives can complement traditional monetary compensation to motivate effort. Such incentives can serve as a more efficient alternative to wages and solve many incentive problems caused by the limitations of a purely financial incentive contract, including adverse selection problems, moral hazard problems, and coordination failures."
325,Exploited By Images,"Padejski, Andjela","Cinema and Media Studies
Art",2020,"Joskowicz, Claudia",
326,"When Personalities Dominate, Stability Fails: Great Britain's Shifting North American Military Strategy, 1768-1775","Page, Anna",,2017,"Grandjean, Katherine","History may be written by the victors, but war is not a solo act. Yet the narrative surrounding the American Revolutionary War makes it seem as though the other major actor in the conflict, Great Britain, only reacted to the events in the North American colonies and yielded no personal motives to ultimately declare war. Responsibility for deciding to go to war in 1775 is essentially removed from British pre-war political and military leaders. Limited discussion is held about the exogenous factors that would have influenced British decision makers. This thesis, however, seeks to fill that gap. It assesses how and why Great Britain's North American military strategy evolved the way it did. I map changes in strategy starting in 1768 when the first schooner, packed with British military forces, arrived in Boston Harbor until April 1775 with the march on Concord. Through three chapters looking at the important English personalities in charge of the military decision-making process, the actions of Great Britain's neighboring countries, and the strength of England's economy from 1768-1775, the nuances of the causes of warfare are discussed."
327,"Analysis of the nutrient composition, efficacy, and sustainability of bokashi fertilizers","Abo-Sido, Nisreen",Environmental Studies/Science,2018,,
