,title,author,dept,year,advisor,abstract
470,"Facinus, quos inquinat, aequat: The Mutinies of Lucan's Bellum civile","Tobin, Carolyn",Classical Studies,2013,"Starr, Raymond","For a people with fierce nostalgia for republican governance, Roman authors were astonishingly negative about the common people who once gathered together to serve as their legislature and their army. This paper explores the relationships between civil war generals and their troops in Lucan's Bellum civile, an Imperial historical epic that deals with the wars between Julius Caesar and Pompey in the late 40s BCE, with the traditional Roman scorn for crowds in mind. Specifically, the paper looks at moments of potential mutiny against each major general in the poem and how Lucan uses these moments to characterize the moral qualities of each general, investigate the psyche of the common soldier, and deliberate on the meaning of civil war. The common soldiers have the power to change the tide of events if they stand together, but any crowd is also made up of individuals whom Lucan wishes would think for themselves and recognize the immorality of their behavior - an act that could undermine the commander for each individual but would make them lose their collective power. Ultimately, though there are four major potentially mutinous situations throughout the poem, Caesar's great mutiny against Roma - the civil war itself - is the only one that succeeds. Unlike many Classical historical texts, in Lucan's poem it is not the mob that is the enemy but the one man, and thus the poet can lament the fact that the common soldiers fail to use their power rather than fear the fact that they could."
471,Community in Education: Lessons Learned from Around the World,"Wu, Jiezhen","Peace and Justice Studies
Education",2013,"Rosenwald, Larry
Hawes, Kenneth",
472,Localizing Justice: Beyond the Chambers of the ICTY to the People of Sanski Most,"Sprague, Kathleen",Anthropology,2013,"Karakasidou, Anastasia","My research focuses on the efficacy of the International Criminal Tribunal of the Former Yugoslavia (ICTY), a judicial mechanism established in The Hague in response to the mass atrocities committed throughout the northern Balkans in the 1990s. Based on my ethnographic fieldwork conducted in Sanski Most, a small town in northwestern Bosnia, I explore residents' notions of justice following the Yugoslav wars and their overlap as well as disjuncture from Western priorities and initiatives. More broadly, my research hovers at the intersection of legal anthropology and human rights. While it is founded soundly in anthropological methodology and literature, I also utilize insights from other disciplines in order to contribute to the growing multidisciplinary discourse surrounding transitional justice."
473,"Putin's Youth: Nashi and the Pro-Regime Youth Movement in Russia, 2000-2012","Lee, Angela",History,2013,"Tumarkin, Nina","Since becoming President of the Russian Federation, Vladimir Vladimirovich Putin (2000-2008; 2012-) and the ruling elite have attempted to mobilize the youth for political participation in support of the regime. A number of pro-Kremlin youth organizations emerged in tandem with Putin's accession to, and consolidation of, power. My thesis explores the formation, development, and transformation of these pro-regime youth organizations in Russia from 2000 to 2012, with a particular focus on Nashi (""Ours""), established by Kremlin officials in 2005. As the most visible and influential politically-oriented youth organization to appear in Russia during this time period, Nashi was, for a time, a powerful symbol of patriotic youth activism and official state politics. Along with my historical discourse on Nashi and the pro-Kremlin youth movement, I identified a set of youth groups whose activities aimed to oppose or undermine the personal figure and politics of Putin, and correspondingly, Nashi. In doing so, I examined the divergence of political imperatives and competing interests between Nashi and the opposition youth movement that made youth politics specially contentious during the first decade of the twenty-first century."
474,Narrating Selves: The Production of Meaning and Value from Military Experience,"Kenney, Kathryn",Anthropology,2013,"Matzner, Deborah",
475,Gedrehte Zungen: Sprache und Identitätskonstruktion in literarischen Werken von Minderheitenschriftsteller_innen in Deutschland,"Tan, Yan An",German Studies,2013,"Nolden, Thomas",
476,Revelatory Words and Images: William Blake and the Artist's Book,"Li, Ruth",English,2013,"Hickey, Alison","Merging literature and visual art, artist's books reveal the fascinating experiment between word and image. The works of the Romantic poet, printer, and visionary William Blake invite exploration of this relationship. Blake's illustrations in Songs of Innocence and Experience, revelatory in themselves, often subtly undercut or complicate the meanings of his writings, offering a complex view of the songs as both literary creations and material objects. Blake conceived the medium of the book as an ideal vehicle that, marrying text and image, had the power to join the author and the reading public. In addition to interpreting Blake's poems, I examine his books as material objects, paying special attention to the relation of text and image. With Blake's powerful example in mind, I proceed to examine contemporary ""artist's books"" in order to gain insights into the continuing evolution of the book form."
477,The World's Contracted Thus: The Animation of Microcosmic Space in the Lyric Poetry of John Donne and Andrew Marvell,"Linnell, Gabrielle",Medieval and Renaissance Studies,2013,"Wall-Randell, Sarah","This project analyzes the role of microcosms in selected poems by John Donne and Andrew Marvell; primarily, it seeks to understand the role of animated microcosmic space in illuminating poetic concerns such as romantic desire, the search for God, and the understanding of self."
478,Why Women's Colleges?: Reassessing the Benefits of Single-Sex Higher Education for Women,"Wisner, Teresa",Sociology,2013,"Swingle, Joseph","In the United States today, young women have access to virtually all of the country's best colleges and universities. However, research suggests that single-sex education may still be beneficial to women in ways that co-education is not. Women's colleges encourage students to pursue non-traditional career paths, offer more female role models and mentoring opportunities, provide more leadership experiences on campus, and cultivate generally supportive campus environments in which students develop social and academic self-confidence. In this study, I examine the experiences of female students at two women's colleges and two co-educational colleges and find that women's college students differ from their peers as prospective students in that they are more likely to be seeking academically challenging environments. After arriving on campus, they are more likely to report positive social experiences and interactions with diversity during their first year, though this difference is eliminated in subsequent years. They are also more likely to hold leadership positions and somewhat more likely to switch to and persist in STEM fields. I suggest that women's colleges still offer real benefits to their students, and that co-educational colleges should look to them as effective models of how to support both male and female students on their campuses."
479,"Fires, Façades, and Empty Metaphors: Staging Euripides' Orestes","Wilson, Megan",Classical Studies,2013,"Dougherty, Carol",
480,The Impact of Private Sector Pricing Policy on Health Care: Evidence from Wal-Mart's $4 Prescription Program,"Wang, You",Economics,2013,"McKnight, Robin","In 2006, Walmart launched a program that cut prices of nearly 300 generic prescription drugs to $4 per prescription for a month's supply. This is a nation-wide program and is available to people with or without insurance. My thesis research examines the impact of a private firm's pricing policy on health spending behavior, health utilization and health outcomes."
481,"Determining the Role of the Hedgehog Signaling Pathway during Limb Regeneration in the Red Flour Beetle, Tribolium castaneum","Villarreal, Carla Mayela",Biological Sciences,2013,"Suzuki, Yuichiro","Despite studies performed on many species, including amphibians and insects, the mechanisms regulating limb regeneration remain poorly understood. Hedgehog (Hh) is a major signaling pathway found in most, if not all, animal species, including humans. In vertebrates, Hh signaling has been shown to play key roles during limb regeneration. To determine whether Hedgehog might also play a role during limb regeneration in Tribolium castaneum, Hh signaling was silenced through RNA interference. In normal development, silencing of Hh signaling resulted in alteration of limb morphology. Disruption of Hh signaling during regeneration led to the impairment of blastema growth and subsequent adult limb morphogenesis during metamorphosis. Furthermore, cellular proliferation in the blastema diminished with the silencing of Hh. Our findings indicate that Hh signaling is necessary for regeneration in beetles similar to vertebrates and have broader implications for our understanding of the developmental and evolutionary origins of set-aside cells."
482,Is Being Korean Cosmopolitan Possible? Exploring the Self-Identity and Worldview of Korean International Students at American Colleges,"Park, Ji-Su",Sociology,2013,"Swingle, Joseph","Of what relevance is national identity to students who spend extended periods of time away from their ""home"" nation? Is it possible for an individual to be nationalistic and cosmopolitan simultaneously? This study examines Korean international students attending college or university in the U.S. These students grew up in a ""one-blood"" nation but now find themselves in a far more racially and ethnically diverse nation. My research explores how the U.S. experiences of these students influence their nationalistic versus multicultural/cosmopolitan worldviews. Data come from survey and in-depth one-to-one interviews with Korean international students across the U.S."
483,The Scientific Method's Missing Step: Using Marianne Moore and A.R. Ammons's Poetry to See the Invisible,"Tai, Sharon",English,2013,,
484,An Investigation of the Feasibility and Progress of the Millennium Development Goals in Swaziland - A Case Study,"Kine, Andrea",Africana Studies,2013,"Steady, Filomina","The Millennium Development Goals (MDGs) are Swaziland's time-bound and quantified targets for addressing extreme income poverty, hunger, disease, and lack of adequate shelter, while promoting gender equality, education, and environmental sustainability. The MDGs also promote basic human rights - the rights of each person on the planet to health, education, shelter, and security.[i] The UN Millennium Declaration, also known as the Millennium Development Goals, was adopted at the Millennium Summit in September 2000, and consists of 8 goals to be met by the year 2015. This thesis, entitled, ""An investigation of the feasibility and progress of the Millennium Development Goals in Swaziland - a Case Study,"" aims to assess the position of Swaziland in meeting the MDGs by 2015. An assessment of national policies has been conducted to understand governmental efforts aimed towards development and improvement of livelihoods in Swaziland. A portion of this research includes field research material that is centered on information obtained from interviews with Swazi local women; Hon. Minister of Health Benedict Xaba; His Royal Highness Hon. Minister of Economic Planning and Development Prince Hlangusemphi; Rev. AMC Dlamini, Swaziland's former Minister of Economic Planning and Development; Principal Secretary of Agriculture Dr. Robert Thwala; Business Woman of the Year 2006 and Trustee of the Swazi Royal Family Sylvia Mthethwa This research aims to not only evaluate Swaziland's position in achieving the MDGs, but to also shed an awareness on local efforts by Swazi government, and to evaluate how women in particular are benefitting from developmental efforts [i] Millennium Project: What They Are. UN Millennium Project. Web. 30 August 2012 http://www.unmillenniumproject.org/goals/index.htm"
485,With So Good a Wife: Love and Violence in Shakespeare Plays of Suspected Infidelity,"Ridge, Kelsey",English,2013,"Ko, Yu Jin","In Shakespeare's Much Ado About Nothing, Othello, and Cymbeline, one senses a common thread: false suspicion by the male partner of sexual infidelity by their female partners. However, despite the similarity of their original offenses, each man is punished differently, and these plays reach startlingly different outcomes and fall into a different genre. Scholars have long wondered why. Examining the plays reveals important dissimilarities between these men, their partners, and their relationships, and as the plot and the characters unfold, the couples are driven towards diverse endings. Claudio, barely punished, gets a happy ending. Othello, though, is brutally punished. Finally, Posthumus, also roughly punished, learns how to redeem himself and save his marriage. By rewarding some actions and choices with happy endings and condemning others to sorrow and death, Shakespeare paints a picture about the importance of a certain kind of love and bond in a healthy and strong relationship."
486,Long Night: Poems,"Stenquist, Jaya",English,2013,"Chiasson, Dan",
487,Political' Figures: An Exploration in Paint,"Oh, Yeh Jin",Art,2013,"Harvey, Bunny
Rivera, Daniela",
488,Investigating the Relationship between Age of Acquisition of a Second Language and Lexical Retrieval Ability in Bilinguals,"Takahesu Tabori, Andrea",Psychology,2013,,"The current study investigated the relationship between age of acquisition (AOA) of a second language and lexical retrieval ability in bilinguals. This study compared the lexical retrieval ability of 30 English monolinguals, 25 early Spanish-English bilinguals (AOA birth to three years), and 17 late Spanish-English bilinguals (AOA four to nine years). Participants completed a picture-naming task in English, a measure of non-verbal intelligence (Cattell Culture Fair Test), and a standardized measure of vocabulary size (PPVT-III). We predicted that both bilingual groups would experience more lexical retrieval difficulty on the picture naming tasks relative to monolinguals but that early bilinguals would experience less difficulty than late bilinguals."
489,Forging a New Russian Hero: Post-Soviet Science Fiction and Its Moral Objectives,"Mironciuc, Elena",Russian,2013,"Hodge, Thomas",
490,Why Hip-Hop Is Queer: Using Queer Theory to Examine Identity Formation in Rap Music,"Galis-Menendez, Silvia",Women's and Gender Studies,2013,"Mata, Irene","Although many believe hip-hop is irredeemably misogynistic and homophobic, hip-hop actually provides a unique space for queer interpretations of identity. Rap music is a poetics and a politics in which construction of oppositional narratives and presentation and performances of race, gender, and sexuality is possible. The works of hip hop artists Azealia Banks, Frank Ocean, Las Krudas, and Big Freedia particularly illuminate the processes of identity formation and presentation. Using queerness to examine hip-hop, and using hip-hop to examine queerness demonstrates the significance of hip-hop as a cultural production and social movement."
491,A Reporter's Story: The Significance of Hemingway's Early Work in Journalism,"Simon, Sara",English,2013,"Cain, William",
492,To Sink or Swim: Examining Coastal Sea Level Rise Policy,"Mercer, Kelly",Environmental Studies/Science,2013,,
493,"La République, « Fille Aînée de l'Église »? : la morale républicaine de l'école laïque du XIXe siècle et ses racines catholiques","Yazgi, Elizabeth",French,2013,"Datta, Venita","This thesis uses the secular school of nineteenth-century France to understand one of the ""pillars"" of French identity-la laïcité, or the separation of Church and state. Solidifying itself through anticlerical policy, the French state reified the notion of a Republic-Church opposition. The secularized school and its morale républicaine became instrumental in this process. An analysis of the textbooks which preached this morale républicaine, however, reveals the continuities between the latter and Christian principles. At the same time, an examination of the political debates surrounding school secularization suggests a reason for the obfuscation of such continuities. By unmasking these, I will introduce a more nuanced appreciation of la laïcité and the role of French anticlericalism in shaping conceptions of the Republic."
494,Etrusco-Corinthian Pottery in the Archaic West: An Evaluation of Fineware Exchange and Etruscan Agency,"Bertram, Haley",Classical Studies,2013,"Burns, Bryan","This thesis examines the role of fineware in overseas exchange through an analysis of Etrusco-Corinthian pottery in the Archaic western Mediterranean. By considering stylistic analysis more broadly, as well as the archaeological contexts of the ware, I evaluate the role of the pottery in the Western settlements of Massalia and Saint Blaise, and consider questions of the production and export of the ware. This approach highlights the problematic nature of conclusions drawn about the economic progression of Etrusco-Corinthian pottery as a declining ware. I argue that these conclusions stem from a previous conception of Etruscan inferiority to the Greeks, and that this stereotype has also extended to discussions of Etruscan agency in the West. I assert that Etruscans in the West are functioning within a cosmopolitan world of exchange, and that the Etruscans are visibly active in this market, as demonstrated through the continued demand and consumption of Etrusco-Corinthian sympotica by populations of the West. Based on the archaeological contexts, the consumers of imported wares appear to have been crucial in shaping this demand by actively seeking a varied collection of imported fineware. Questions remain regarding precisely how the production process of the ware relates to export. Despite this, the study of Etrusco-Corinthian pottery in the West clearly establishes the fineware as a commodity, both in Etruria and abroad, and also concludes that Etruscan wares circulated within the cosmopolitan Mediterranean network on a equal, not subordinate, level to Greek wares."
495,Personal Need for Structure: Indiscriminate Classification Systems As Barriers to Processing Mathematical Complexity,"Sarnataro-Smart, Sierra",Psychology,2013,"Hennessey, Beth A.","This study applied previous research findings on stereotyping and individual differences in the need for simple structure to an investigation of math anxiety. The same kind of indiscriminately broad categorical thinking that underpins social stereotyping was observed in math anxious students confronted with mathematical complexity. Study participants who scored high in the need for simple structure were significantly more likely to experience math anxiety and to have adopted the belief that math intelligence is fixed. In addition, this investigation revealed that participants' implicit assumptions about the origins of math intelligence covaried with math anxiety. The potential benefits of introducing the conceptual underpinnings of math problems in a simple, straightforward fashion prior to increasing task difficulty were explored through the presentation of two progressively challenging counting tasks. While math anxious participants did significantly worse than their non-anxious peers on the initial simpler task, as complexity increased, math anxious individuals' degree of success on the second, more challenging task paralleled that of their non-anxious peers. Taken together, these study findings inform our understanding of math anxious students' cognitive barriers to mathematical comprehension and fluency and suggest specific teaching strategies that might be employed to address these issues. Keywords: simple structure, math anxiety, implicit theory, education, gender"
496,Wellesley Manuscript 8: A Case Study of the Interaction Between Form and Text in a Fifteenth-Century English Manuscript,"Grub, Valentina S.",Medieval and Renaissance Studies,2012,"Sergi, Matthew",
497,The Commodification of Literature in Martial's Epigrams,"Black, Rita",Classical Studies,2017,,"The vision behind this thesis, centered on the epigrammatic poetry of Martial (born Marcus Valerius Martialis, 34-41 - c. 103 CE) and the themes within his satiric works, stem from a proposal previously for Roman Poetry and Poetry Books that sought to analyze the connection between Martial's intense focus on his reader (lector) and his fixation on the materiality of his text (known as libellus or ""little book"" throughout his many works) in order to identify Martial's literary and social motives. Martial's choices to not only publish his books for the general public but circulate these texts through booksellers lead to the characterization of Martial as one of the preeminent authors of innovative poetry in the Roman Empire. This thesis seeks to investigate, analyze, and discuss the relationships present in Martial's works between author and audience, text and its physical form, and poet and patron. In analyzing the complexities of Martial's poetry and his own approach to literature and relationships, modern readers can gain insight into the world of classical poetry and art as well as the social dynamics, political tensions, and inherent economic disparities of ancient Rome. This thesis seeks to answer how these relationships between author and audience, poetry and its physical form, and patron and poet intersect in Martial's epigrams and become integral to the transformative nature of his work."
498,"""The Experience of Flying"": The Rand Dogma and its Literary Vehicle","Bond, Camille",English,2017,"Cain, William",
499,Mind over Matter? The Changing Status of On Kawara's Conceptual Art Objects,"Borno, Aisha Lovise Ma",Art,2017,"Berman, Patricia","The creation of the conceptual work of art begins with the artist's idea and ends with its communication or implementation. Hereafter the idea can only be encountered insofar as its materialization acts as record, embodiment, or agent of the work. The life of the object has however just begun. As the materials leave the artist's ownership and enter the art world, they become artifacts, whose ascribed value and meaning shift as they enter different contexts. This thesis examines the complex and ambiguous relationship between a work's conceptual aims and its material presence through a trifold exploration of the oeuvre of Japanese artist On Kawara (1933-2014). Following the life of Kawara's conceptual art objects as they are realized in the studio, enter the market and exhibition, and transition to their afterlife in permanent museum collections, I consider how the changing status of the object shapes the meaning of the conceptual work."
500,The Effect of Social Security on Savings,"Burnam, Rose",Economics,2017,"Fetter, Daniel",
501,Transparency and Toxic Waste: State Decisions to Report and Import Toxic Waste,"Cathcart, Kelsey",Environmental Studies/Science,2017,,"This study examines a country's reporting behavior and its decision to import toxic waste within the Basel Convention on the Control of Transboundary Movements of Hazardous Wastes and Their Disposal. I examine the contexts in which states report and make decisions to import toxic waste within both industrialized and developing countries. It appears that wealth influences a country's capacity to establish reporting systems, with reduced transparency of the toxic waste trade in developing countries. Although most countries that do import toxic waste are industrialized, the developing countries that do import toxic waste are the most corrupt developing countries."
