,name,title,title2,title3,education
388,Susan E. Skeath,Professor of Economics,,,"B.A., Haverford College; M.A., Ph.D., Princeton University"
389,Christa D. Skow,Senior Instructor in Biological Sciences Laboratory,,,"B.S., Ph.D., University of Massachusetts (Amherst)"
390,Stephen Michael Slivan,Instructor in Astronomy Laboratory,,,"S.B., S.M., Ph.D., Massachusetts Institute of Technology"
391,Quinn SlobodianA,Associate Professor of History,,,"B.A., Lewis & Clark College; Ph.D., New York University"
392,Alexandria Smith,Assistant Professor of Art,,,"B.F.A., Syracuse University; M.A., New York University; M.F.A., Parsons The New School for Design"
393,Mingwei Song,Associate Professor of Chinese,,,"B.A., Shandong University; M.A., Fudan University; M.Phil., Ph.D., Columbia University"
394,Tessa Spillane,PERA Associate Professor of the Practice,,,"B.A., Mount Holyoke College; M.S., Smith College"
395,Rachel H. R. Stanley,Assistant Professor of Chemistry,,,"B.S., Ph.D,  Massachusetts Institute of Technology"
396,Glenn Stark,Professor of Physics,,,"B.S., Massachusetts Institute of Technology; M.A., Ph.D., University of California (Berkeley)"
397,Jane E. Starkman,Music Performance Faculty in Baroque Violin,,,"B.M., M.M., New England Conservatory of Music"
398,Raymond James Starr,Theodora Stone Sutton Professor of Classics,Professor of Classical Studies,,"B.A., University of Michigan (Ann Arbor); M.A., Ph.D., Princeton University"
399,Filomina Chioma Steady,Professor of Africana Studies,,,"B.A., Smith College; M.A., Boston University; B.Litt., D.Phil., Oxford University"
400,Lindsey Stewart,Mellon Postdoctoral Fellow in Philosophy,,,"B.A., Calvin College; Ph.D., Pennsylvania State University"
401,Suzanne E. Stumpf,"Senior Music Performance Faculty in Flute, Baroque Flute, and Chamber Music",,,"B.A., Wellesley College"
402,Yui Suzuki,Associate Professor of Biological Sciences,,,"A.B., Bowdoin College; Ph.D., Duke University"
403,Joseph F. Swingle,Senior Lecturer in Sociology,,,"B.A., Carleton College; M.A., Ph.D., Harvard University"
404,Jill Ann Syverson-Stork,Senior Lecturer in Spanish,,,"B.A., Smith College; M.A., Ph.D., Harvard University"
405,Olga W. Talroze,Senior Coach/accompanist,,,"B.M., M.M, San Francisco Conservatory of Music"
406,Jenny Chui-Chun Tang,Lecturer in Music,"Co-Director, Wellesley Chamber Music Society",Senior Music Performance Faculty in Piano and Keyboard Skills,"B.M., M.M., New England Conservatory of Music"
407,Qiuyan Tang,Lecturer in Chinese,,,"B.A., Nanjing Normal University; M.A., Fudan University"
408,Jonathan Eric Tannenhauser,Lecturer in Mathematics,,,"A.B., Harvard University; M.A., Ph.D., University of California (Berkeley)"
409,Corrine Taylor,Senior Lecturer in the Quantitative Reasoning Program,"Director, Quantitative Reasoning Program",,"B.A., College of William and Mary; M.S., Ph.D., University of Wisconsin (Madison)"
410,Marc J. Tetel,Professor of Neuroscience,,,"B.A., Northwestern University; Ph.D., University of Massachusetts (Amherst)"
411,Shiao-Wei ThamA1,Associate Professor of Chinese,,,"B.A., National University of Singapore; M.A., Ph.D., Stanford University"
412,Sally A. TheranA,Associate Professor of Psychology,,,"B.A., Bates College; M.A., Ph.D., Michigan State University"
413,Marcia E. Thomas,Senior Instructor in Biological Sciences Laboratory,,,"B.S., University of Massachusetts; M.A., Smith College"
414,Rebecca E. Thornblade,Music Performance Faculty in Cello,,,"B.M., Oberlin Conservatory; M.M., Juilliard School"
415,Brian C. Tjaden,Professor of Computer Science,,,"B.A., Amherst College; M.S., Ph.D., University of Washington"
416,Eiko Torii-Williams,Senior Lecturer in Japanese,,,"B.A., Kansai University (Osaka); Ed.M., Ph.D., Boston University"
417,David Towlun,Theatre Production Manager,,,"M.F.A., Purchase College (State University of New York)"
418,Donna R. Trainor,Senior Instructor in Chemistry Laboratory,,,"B.A., University of Rochester; Ph.D., University of Akron"
419,Marie-Paule Tranvouez,Senior Lecturer in French,,,"D.U.T., Institut Universitaire de Technologie, (Brest); M.A., State University of New York (Stony Brook); Ph.D., University of California (Santa Barbara)"
420,Ann TrenkA2,Professor of Mathematics,,,"A.B., Harvard University; M.S., Ph.D., Johns Hopkins University"
421,Nina Tumarkin,Kathryn Wasserman Davis Professor of Slavic Studies,Professor of History,,"B.A., University of Rochester; M.A., Ph.D., Harvard University"
422,Franklyn A. Turbak,Associate Professor of Computer Science,,,"S.B., M.S., Ph.D., Massachusetts Institute of Technology"
423,Shelby Turcotte,"Instructor in Physical Education, Recreation and Athletics",,,"B.S., University of Southern Maine"
424,James Turner,Associate Professor of Environmental Studies,,,"B.S., Washington and Lee University; A.M., Brown University; Ph.D., Princeton University"
425,Diane Tutin,Lecturer in Education,,,"B.A., Clark University; M.Ed., Framingham State College"
426,"L. Terrell Tyler, Jr.",Associate Professor of English,,,"B.A., Southwestern University (Memphis); M.A., M.Phil., Ph.D., Yale University"
427,Catherine Ulissey,"Instructor in Physical Education, Recreation and Athletics",,,"B.A., Emerson College"
428,Adam Van Arsdale,Whitehead Associate Professor of Critical Thought,Associate Professor of Anthropology,,"B.A., B.S., Emory University; M.A., Ph.D., University of Michigan"
429,Carlos Alberto Vega,Professor of Spanish,,,"A.B., Columbia University; A.M., University of Virginia; Ph.D., Harvard University"
430,Ann Velenchik,Associate Professor of Economics,Dean of Academic Affairs,,"B.S.F.S., Georgetown University; Ph.D., Stanford University"
431,Monica Verity,PERA Assistant Professor of the Practice,,,"B.S., Wagner College; M.S., Boston College"
432,Carla M. Verschoor,Adjunct Assistant Professor of Chemistry,,,"B.S., University of Illinois (Urbana); Ph.D., University of Wisconsin (Madison)"
433,Maurizio S. Viano,Professor of Cinema and Media Studies,,,"Laurea in Lettere Moderne, University of Genova; Ph.D., University of Oregon"
434,Lynne Spigelmire Viti,Senior Lecturer in the Writing Program,,,"B.A., Barnard College; M.A., Columbia University; Ph.D., J.D., Boston College"
435,Ismar Volic,Theresa Mall Mullarkey Associate Professor of Mathematics,,,"B.A., Boston University; M.A., Ph.D., Brown University"
436,Sarah Elizabeth Wall-RandellA1,Associate Professor of English,,,"B.A., Wellesley College; M.Phil, St. John’s College (Oxford University); Ph.D., Harvard University"
437,James Wallenstein,Newhouse Visiting Professor of Creative Writing,,,"B.A., Wesleyan University; M.A., Ph.D., University of California (Berkeley)"
438,Maria N. Waller,Instructor in Geosciences Laboratory,,,"B.A., Wellesley College; M.S., University of Massachusetts"
439,Julie Walsh,Assistant Professor of Philosophy,,,"B.A., University of Toronto; M.A., Ph.D., University of Western Ontario"
440,Helen P. Wang,Professor of Mathematics,,,"B.A., University of Wisconsin (Madison); M.A., Ph.D., Harvard University"
441,Qing (Wendy) Wang,Assistant Professor of Mathematics,,,"B.S., Beijing Normal University; M.S., Ph.D., Pennsylvania State University"
442,David M. Ward,Professor of Italian Studies,,,"B.A., University of East Anglia (England); M.A., Ph.D., Cornell University"
443,Lauri L. Wardell,Senior Instructor in Physics Laboratory,,,"B.S., Fort Lewis College; M.S., University of Kentucky"
444,Kera M. Washington,Senior Music Performance Faculty in African Diaspora Drumming,"Director, Yanvalou",,"B.A., Wellesley College; M.A., Wesleyan University"
445,Sara Wasserman,Assistant Professor of Neuroscience,,,"B.A., Wellesley College; M.A., Pepperdine University; Ph.D., Brandeis University"
446,Wesley Andres Watters,Diana Chapman Walsh Assistant Professor of Astronomy,,,"B.S., M.S., Ph.D., Massachusetts Institute of Technology"
447,Catherine J. Wearing,Associate Professor of Philosophy,,,"B.A., McGill University; Ph.D., Harvard University"
448,Deborah Weaver,"Instructor in Physical Education, Recreation and Athletics",,,"Certificate, London School of Contemporary Dance"
449,Andrew C. Webb,Professor of Biological Sciences,,,"B.S., Ph.D., University of Southampton (England)"
450,Dorothy A. Webb,PERA Professor of the Practice,,,"B.A., University of the Pacific; M.A., Brown University"
451,Shannon N.  Weber,Visiting Lecturer in Women's and Gender Studies,,,"A.B., Mount Holyoke College; M.A., Ph.D., University of California, Santa Barbara"
452,Akila Weerapana,Associate Professor of Economics,,,"B.A., Oberlin College; A.M., Ph.D., Stanford University"
453,Adam WeinerA1,Associate Professor of Russian,,,"B.A., M.A., Ph.D., University of Wisconsin (Madison)"
454,Cord J. Whitaker,Assistant Professor of English,,,"B.A., Yale University; M.A., Ph.D. Duke University"
455,Ellen B. Widmer,Mayling Soong Professor of Chinese Studies,Professor of East Asian Studies,,"B.A. Wellesley College; M.A., Fletcher School of Law and Diplomacy; M.A., Ph.D., Harvard University"
456,Michael Wiest,Associate Professor of Neuroscience,,,"B.A., Dartmouth College; M.S., Ph.D., Michigan State University"
457,Jeremy B. Wilmer,Assistant Professor of Psychology,,,"B.A., Williams College; Ph.D., Harvard University"
458,Tom Wilson,"Instructor in Physical Education, Recreation and Athletics",,,"B.S.Ed., M.A., Central Missouri State University"
459,Paul M. Wink,Nellie Zuckerman Cohen & Anne Cohen Heller Professor in Health Sciences,Professor of Psychology,,"B.A., M.A., University of Melbourne; Ph.D., University of California (Berkeley)"
460,Adele WolfsonA,Nan Walsh Schow ‘54 and Howard B. Schow Professor in the Physical and Natural Sciences,Professor of Chemistry,,"B.A., Brandeis University; Ph.D., Columbia University"
461,Kara Wong,"Instructor in Physical Education, Recreation and Athletics",,,"B.A., Wellesley College"
462,Benjamin P. Wood,Assistant Professor of Computer Science,,,"B.A., Williams College; M.S., Ph.D., University of Washington"
463,Winifred Jane Wood,Senior Lecturer in the Writing Program,,,"B.A., University of Illinois (Urbana); M.A., University of Iowa; Ph.D., University of Massachusetts (Amherst)"
464,Hannah Woodruff,"Instructor in Physical Education, Recreation and Athletics",,,"B.A., Wellesley College"
465,Elizabeth Marie Young,Knafel Assistant Professor of Humanities,Assistant Professor of Classical Studies,,"B.A., Columbia University; Ph.D., University of California (Berkeley)"
466,Ina Zdorovetchi,Music Performance Faculty in Harp,,,"B.M., Bucharest University of Music; B.M., Boston Conservatory; M.M., Boston University College of Fine Arts"
467,Paula H. Zeitlin,Senior Music Performance Faculty in Jazz Violin,,,"B.A., Earlham College; M.A., University of Chicago"
468,Weina Zhao,Senior Lecturer in Chinese,,,"B.A., Nanjing University; M.A., Clark University"
469,Eve Zimmerman,Barbara Morris Caspersen Associate Professor of Humanities,Associate Professor of Japanese,,"B.A., University of Pennsylvania; Ph.D., Columbia University"
470,Dan Zitnick,Lecturer in Middle Eastern Studies,,,"B.A., M.A., University of Michigan"
